{
  "schema": "capability-pack/v1",
  "capability": "opentofu",
  "area": "infrastructure",
  "version": 1,
  "summary": "Minimal valid pack descriptor.",
  "provisioning": {
    "kind": "recipe",
    "tool": "tofu",
    "version": "1.12.5",
    "environment": {},
    "artifacts": {
      "linux-amd64": {
        "url": "https://example.invalid/tofu_1.12.5_linux_amd64.zip",
        "sha256": "aaaaaaaaaaaaaaaaaaaaaaaaaaaaaaaaaaaaaaaaaaaaaaaaaaaaaaaaaaaaaaaa"
      }
    }
  },
  "discovery": {
    "roots": {"fileGlob": "**/*.tf"},
    "excludeDirs": []
  },
  "assertions": [],
  "gates": [
    {"name": "opentofu-validate", "command": "tofu", "args": ["validate"], "scope": "per-root"}
  ]
}
