{
  "schema": "capability-pack/v1",
  "capability": "opentofu",
  "area": "infrastructure",
  "version": 1,
  "summary": "Fully populated pack descriptor exercising every surface.",
  "provisioning": {
    "kind": "recipe",
    "tool": "tofu",
    "version": "1.12.5",
    "environment": {
      "OPENTOFU_ENFORCE_GPG_VALIDATION": "true",
      "TF_IN_AUTOMATION": "true",
      "TF_INPUT": "false"
    },
    "artifacts": {
      "linux-amd64": {
        "url": "https://example.invalid/tofu_1.12.5_linux_amd64.zip",
        "sha256": "aaaaaaaaaaaaaaaaaaaaaaaaaaaaaaaaaaaaaaaaaaaaaaaaaaaaaaaaaaaaaaaa",
        "signature": "https://example.invalid/tofu_1.12.5_linux_amd64.zip.sig"
      },
      "windows-amd64": {
        "url": "https://example.invalid/tofu_1.12.5_windows_amd64.zip",
        "sha256": "bbbbbbbbbbbbbbbbbbbbbbbbbbbbbbbbbbbbbbbbbbbbbbbbbbbbbbbbbbbbbbbb",
        "signature": "https://example.invalid/tofu_1.12.5_windows_amd64.zip.sig"
      },
      "darwin-arm64": {
        "url": "https://example.invalid/tofu_1.12.5_darwin_arm64.zip",
        "sha256": "cccccccccccccccccccccccccccccccccccccccccccccccccccccccccccccccc",
        "signature": "https://example.invalid/tofu_1.12.5_darwin_arm64.zip.sig"
      }
    }
  },
  "discovery": {
    "roots": {"fileGlob": "**/*.tf"},
    "excludeDirs": [".build", ".git", ".terraform", "dist"]
  },
  "assertions": [
    {"name": "opentofu-version", "command": "tofu", "args": ["version"], "expect": "OpenTofu v1.12.5"}
  ],
  "gates": [
    {"name": "opentofu-fmt-check", "command": "tofu", "args": ["fmt", "-check", "-recursive"], "scope": "repository"},
    {"name": "opentofu-init", "command": "tofu", "args": ["init", "-backend=false", "-input=false", "-no-color"], "scope": "per-root", "timeout": "10m"},
    {"name": "opentofu-validate", "command": "tofu", "args": ["validate", "-no-color"], "scope": "per-root"}
  ]
}
