{
  "schema": "capability-pack/v1",
  "capability": "cosign",
  "area": "security",
  "version": 1,
  "summary": "Sigstore cosign signature verifier: the engine-bound bootstrap pack whose digest-pinned recipe provisions the verifier binary that proves every signature-bound pack artifact; the single documented digest-only exception.",
  "provisioning": {
    "kind": "recipe",
    "tool": "cosign",
    "version": "3.0.6",
    "environment": {},
    "artifacts": {
      "linux-amd64": {
        "url": "https://github.com/sigstore/cosign/releases/download/v3.0.6/cosign-linux-amd64",
        "sha256": "c956e5dfcac53d52bcf058360d579472f0c1d2d9b69f55209e256fe7783f4c74"
      },
      "windows-amd64": {
        "url": "https://github.com/sigstore/cosign/releases/download/v3.0.6/cosign-windows-amd64.exe",
        "sha256": "9b85a88ebff2d9dd30ff4984a6f61f2cedc232dd87d81fa7f2ff3c0ed96c241c"
      },
      "darwin-arm64": {
        "url": "https://github.com/sigstore/cosign/releases/download/v3.0.6/cosign-darwin-arm64",
        "sha256": "5fadd012ae6381a6a29ff86a7d39aa873878852f1073fc90b15995961ecfb084"
      }
    }
  },
  "assertions": [
    {"name": "cosign-version", "command": "cosign", "args": ["version"], "expect": "v3.0.6"}
  ]
}
